{
  "schemaVersion": 1,
  "id": "podcast",
  "name": "Podcast Feeds",
  "version": "1.1.0",
  "reaCmsVersion": "^1.0",
  "description": "Database-backed podcast RSS synchronization and cached API feeds.",
  "author": "Rea CMS",
  "navigation": {"label": "Podcast Feeds", "path": "/cms/podcast"},
  "tables": [
    "plugin_podcast_feeds",
    "plugin_podcast_episodes",
    "plugin_podcast_settings",
    "plugin_podcast_schedule_days"
  ],
  "permissions": [
    "podcast.feeds.view",
    "podcast.feeds.create",
    "podcast.feeds.update",
    "podcast.feeds.delete",
    "podcast.feeds.refresh",
    "podcast.settings.manage"
  ],
  "api": {
    "resource": "podcast",
    "formats": ["json", "html", "txt"],
    "defaultPolicy": "same-origin",
    "fields": {
      "id":{"type":"integer","label":"ID","description":"Unique feed or episode identifier."},
      "slug":{"type":"string","label":"Slug","description":"URL-safe feed or episode slug."},
      "title":{"type":"string","label":"Title","description":"Podcast or episode title."},
      "description":{"type":"html","label":"Description","description":"Podcast or episode description."},
      "content":{"type":"html","label":"Content","description":"Full episode rich-text content."},
      "link":{"type":"url","label":"Website link","description":"Publisher website link."},
      "language":{"type":"string","label":"Language","description":"Podcast language code."},
      "author":{"type":"string","label":"Author","description":"Podcast author or publisher."},
      "imageUrl":{"type":"url","label":"Image URL","description":"Podcast or episode artwork URL."},
      "explicit":{"type":"boolean","label":"Explicit","description":"Explicit-content indicator."},
      "feed.id":{"type":"integer","label":"Feed ID","description":"Parent feed identifier for an episode."},
      "feed.slug":{"type":"string","label":"Feed slug","description":"Parent feed slug for an episode."},
      "feed.title":{"type":"string","label":"Feed title","description":"Parent feed title for an episode."},
      "guid":{"type":"string","label":"GUID","description":"Source feed episode identifier."},
      "audio.url":{"type":"url","label":"Audio URL","description":"Episode audio file URL."},
      "audio.length":{"type":"integer","label":"Audio length","description":"Episode audio size in bytes when supplied."},
      "audio.type":{"type":"string","label":"Audio MIME type","description":"Episode audio MIME type."},
      "audio.durationSeconds":{"type":"integer","label":"Duration","description":"Episode duration in seconds."},
      "audio.durationFormatted":{"type":"string","label":"Formatted duration","description":"Episode length in hours and whole minutes, such as 1 hour 25 minutes; empty when unavailable."},
      "episodeType":{"type":"string","label":"Episode type","description":"Full, trailer, or bonus episode classification."},
      "publishedDate":{"type":"string","label":"Formatted publication date","description":"Episode date in the feed timezone, such as September 8, 2026; empty when unavailable."},
      "publishedTime":{"type":"string","label":"Formatted publication time","description":"Episode time in the feed timezone, such as 8:30 PM; empty when unavailable."},
      "publishedAt":{"type":"datetime","label":"Published date","description":"Episode publication timestamp in ISO 8601 format."}
    }
  }
}
